,name,stars,review,price,note,open_time,restautant_type,address
0,People's Committee of Trung Lap Upper Commune,4.8,(12),None,[],[],Local government office,3F23+F39
1,Xã Trung lập thượng- Huyện Củ Chi,4.6,(5),None,[],[],Housing society,06 Đường 708
2,Quán chòi xéo,4.7,(6),None,"['Dine-in', 'Takeout']","['Open', ' ⋅ Closes 10\u202fPM']",Restaurant,"3F42+MGH, Unnamed Road"
3,Trung Lap Thuong Primary School,4.2,(10),None,[],['Open 24 hours'],School,499Trung Lập
4,Trạm Y Tế Xã Trung Lập Thượng,4.5,(2),None,[],[],Community health centre,83 Trung Lập
